{
    "version": 1,
    "supportedProjectTypes": [ ],
    "id": "J.QEP",
    "category": "U.QEP",
    "trDescription": "Creates an Effect Maker file.",
    "trDisplayName": "Effect File (Effect Maker)",
    "trDisplayCategory": "Effects",
    "iconText": "qep",
    "platformIndependent": true,
    "enabled": true,

    "options": { "key": "DefaultSuffix", "value": "qep" },

    "pages" :
    [
        {
            "trDisplayName": "Location",
            "trShortTitle": "Location",
            "typeId": "File"
        },
        {
            "trDisplayName": "Project Management",
            "trShortTitle": "Summary",
            "typeId": "Summary"
        }
    ],
    "generators" :
    [
        {
            "typeId": "File",
            "data":
            {
                "source": "file.qep",
                "target": "%{JS: Util.fileName(value('TargetPath'), value('DefaultSuffix'))}",
                "openInEditor": false
            }
        }
    ]
}
