{
    "version": 1,
    "supportedProjectTypes": [ "CMakeProjectManager.CMakeProject", "Qbs.QbsProject", "Qt4ProjectManager.Qt4Project" ],
    "id": "V.QtQuickControls2Application",
    "category": "F.Application",
    "trDescription": "Creates a deployable Qt Quick 2 application using Qt Quick Controls 2.<br/><br/><b>Note:</b> Qt Quick Controls 2 are available with Qt 5.7 and later.",
    "trDisplayName": "Qt Quick Controls 2 Application",
    "trDisplayCategory": "Application",
    "icon": "../qtquickapplication/qml_wizard.png",
    "featuresRequired": [ "QtSupport.Wizards.FeatureQtQuick.Controls.2" ],
    "enabled": "%{JS: [ %{Plugins} ].indexOf('QmakeProjectManager') >= 0 || [ %{Plugins} ].indexOf('QbsProjectManager') >= 0 || [ %{Plugins} ].indexOf('CMakeProjectManager') >= 0}",

    "options":
    [
        { "key": "ProjectFile", "value": "%{JS: '%{BuildSystem}' === 'qmake' ? '%{ProFile}' : ('%{BuildSystem}' === 'cmake' ? '%{CMakeFile}' : '%{QbsFile}')}" },
        { "key": "ProFile", "value": "%{JS: Util.fileName('%{ProjectDirectory}/%{ProjectName}', 'pro')}" },
        { "key": "QbsFile", "value": "%{JS: Util.fileName('%{ProjectDirectory}/%{ProjectName}', 'qbs')}" },
        { "key": "CMakeFile", "value": "%{ProjectDirectory}/CMakeLists.txt" },
        { "key": "MainCppFileName", "value": "%{JS: 'main.' + Util.preferredSuffix('text/x-c++src')}" },
        { "key": "QtQuickVersion", "value": "2.7" },
        { "key": "QtQuickControls2Version", "value": "2.0" },
        { "key": "QtQuickDialogsVersion", "value": "1.0" },
        { "key": "QtQuickLayoutsVersion", "value": "1.3" },
        { "key": "QtQuickVirtualKeyboardVersion", "value": "2.1" },
        { "key": "UseVirtualKeyboard", "value": "%{JS: [ %{Plugins} ].indexOf('Boot2Qt') >= 0}" }
    ],

    "pages":
    [
        {
            "trDisplayName": "Project Location",
            "trShortTitle": "Location",
            "typeId": "Project"
        },
        {
            "trDisplayName": "Define Build System",
            "trShortTitle": "Build System",
            "typeId": "Fields",
            "enabled": "%{JS: ! %{IsSubproject}}",
            "data":
            [
                {
                    "name": "BuildSystem",
                    "trDisplayName": "Build system:",
                    "type": "ComboBox",
                    "data":
                    {
                        "index": 0,
                        "items":
                        [
                            {
                                "trKey": "qmake",
                                "value": "qmake",
                                "condition": "%{JS: [ %{Plugins} ].indexOf('QmakeProjectManager') >= 0}"
                            },
                            {
                                "trKey": "CMake",
                                "value": "cmake",
                                "condition": "%{JS: [ %{Plugins} ].indexOf('CMakeProjectManager') >= 0}"
                            },
                            {
                                "trKey": "Qbs",
                                "value": "qbs",
                                "condition": "%{JS: [ %{Plugins} ].indexOf('QbsProjectManager') >= 0}"
                            }
                        ]
                    }
                }
            ]
        },
        {
            "trDisplayName": "Define Project Details",
            "trShortTitle": "Details",
            "typeId": "Fields",
            "data":
            [
                {
                    "name": "ControlsStyle",
                    "trDisplayName": "Qt Quick Controls 2 Style:",
                    "type": "ComboBox",
                    "data":
                    {
                        "index": 0,
                        "items":
                        [
                            {
                                "trKey": "Default",
                                "value": "Default"
                            },
                            {
                                "trKey": "Material",
                                "value": "Material"
                            },
                            {
                                "trKey": "Universal",
                                "value": "Universal"
                            }
                        ]
                    }
                }
            ]
        },
        {
            "trDisplayName": "Kit Selection",
            "trShortTitle": "Kits",
            "typeId": "Kits",
            "enabled": "%{JS: ! %{IsSubproject}}",
            "data": { "projectFilePath": "%{ProjectFile}" }
        },
        {
            "trDisplayName": "Project Management",
            "trShortTitle": "Summary",
            "typeId": "Summary"
        }
    ],
    "generators":
    [
        {
            "typeId": "File",
            "data":
            [
                {
                    "source": "app.pro",
                    "target": "%{ProFile}",
                    "openAsProject": true,
                    "condition": "%{JS: '%{BuildSystem}' === 'qmake'}"
                },
                {
                    "source": "CMakeLists.txt",
                    "openAsProject": true,
                    "condition": "%{JS: '%{BuildSystem}' === 'cmake'}"
                },
                {
                    "source": "file.qbs",
                    "target": "%{QbsFile}",
                    "openAsProject": true,
                    "condition": "%{JS: '%{BuildSystem}' === 'qbs'}"
                },
                {
                    "source": "main.cpp",
                    "target": "%{MainCppFileName}"
                },
                {
                    "source": "main.qml.tpl",
                    "target": "main.qml",
                    "openInEditor": true
                },
                {
                    "source": "Page1.qml.tpl",
                    "target": "Page1.qml"
                },
                {
                    "source": "Page1Form.ui.qml.tpl",
                    "target": "Page1Form.ui.qml"
                },
                {
                    "source": "qml.qrc"
                },
                {
                    "source": "qtquickcontrols2.conf"
                },
                {
                    "source": "../git.ignore",
                    "target": ".gitignore",
                    "condition": "%{JS: !%{IsSubproject} && '%{VersionControl}' === 'G.Git'}"
                }
            ]
        }
    ]
}
